{
  "$schema": "https://json-schema.org/draft/2020-12/schema",
  "$id": "https://llm-iq.dev/schemas/public-run.schema.json",
  "title": "PublicRunRecord",
  "description": "公开数据仓单次运行记录结构规范",
  "type": "object",
  "properties": {
    "$schema": {
      "type": "string"
    },
    "publicSchemaVersion": {
      "type": "integer",
      "const": 1
    },
    "runId": {
      "type": "string",
      "pattern": "^\\d{8}T\\d{6}Z$"
    },
    "prompts": {
      "type": "array",
      "items": {
        "type": "object",
        "properties": {
          "promptId": {
            "type": "string",
            "minLength": 1
          },
          "text": {
            "type": "string"
          },
          "bindings": {
            "type": "object",
            "additionalProperties": {
              "type": "string"
            }
          }
        },
        "required": [
          "promptId",
          "text",
          "bindings"
        ],
        "additionalProperties": false
      }
    },
    "startedAt": {
      "type": "string",
      "format": "date-time"
    },
    "finishedAt": {
      "type": "string",
      "format": "date-time"
    },
    "durationMs": {
      "type": "integer",
      "minimum": 0
    },
    "trigger": {
      "type": "string",
      "enum": [
        "schedule",
        "manual"
      ]
    },
    "inProgress": {
      "type": "boolean",
      "const": false
    },
    "cancelledAt": {
      "type": [
        "string",
        "null"
      ],
      "format": "date-time"
    },
    "harnessGuard": {
      "type": "string",
      "minLength": 1,
      "description": "本轮附在每条提示词之后的直出约束原文（不联网、不跑代码自测、不截图自检）；没开的轮次没有此字段，prompts[].text 仍是题目原文"
    },
    "budgetStop": {
      "type": [
        "boolean",
        "object",
        "string",
        "null"
      ]
    },
    "attempts": {
      "type": "array",
      "items": {
        "$ref": "#/$defs/PublicAttempt"
      }
    },
    "redactions": {
      "type": "array",
      "items": {
        "type": "object",
        "properties": {
          "file": {
            "type": "string"
          },
          "reason": {
            "type": "string"
          }
        },
        "required": [
          "file",
          "reason"
        ],
        "additionalProperties": false
      }
    },
    "profiles": {
      "type": "array",
      "description": "本轮调用用到的上游 profile 公开视图；引入前的记录没有此字段",
      "items": {
        "$ref": "#/$defs/PublicProfile"
      }
    }
  },
  "required": [
    "publicSchemaVersion",
    "runId",
    "prompts",
    "startedAt",
    "finishedAt",
    "durationMs",
    "trigger",
    "inProgress",
    "attempts",
    "redactions"
  ],
  "additionalProperties": false,
  "$defs": {
    "PublicAttempt": {
      "type": "object",
      "properties": {
        "targetId": {
          "type": "string"
        },
        "promptId": {
          "type": "string"
        },
        "cli": {
          "type": "string"
        },
        "profile": {
          "type": "string",
          "minLength": 1,
          "description": "非登录态的上游 profile 名，须在顶层 profiles 里登记；登录态不写"
        },
        "model": {
          "type": "string"
        },
        "effort": {
          "type": [
            "string",
            "null"
          ]
        },
        "appliedEffort": {
          "type": [
            "string",
            "null"
          ]
        },
        "effortHonored": {
          "type": [
            "boolean",
            "null"
          ]
        },
        "label": {
          "type": "string"
        },
        "status": {
          "type": "string",
          "enum": [
            "ok",
            "no-svg",
            "error",
            "timeout"
          ]
        },
        "svgFile": {
          "type": [
            "string",
            "null"
          ]
        },
        "rawFile": {
          "type": "null"
        },
        "startedAt": {
          "type": "string",
          "format": "date-time"
        },
        "finishedAt": {
          "type": "string",
          "format": "date-time"
        },
        "durationMs": {
          "type": "integer",
          "minimum": 0
        },
        "svgBytes": {
          "type": [
            "integer",
            "null"
          ],
          "minimum": 0
        },
        "error": {
          "type": [
            "string",
            "null"
          ]
        },
        "judge": {
          "$ref": "#/$defs/PublicJudgement"
        },
        "usage": {
          "type": [
            "object",
            "null"
          ],
          "properties": {
            "tokens": {
              "type": "object",
              "properties": {
                "input": {
                  "type": "integer",
                  "minimum": 0
                },
                "cache_read": {
                  "type": "integer",
                  "minimum": 0
                },
                "cache_write": {
                  "type": "integer",
                  "minimum": 0
                },
                "cache_write_5m": {
                  "type": "integer",
                  "minimum": 0
                },
                "cache_write_1h": {
                  "type": "integer",
                  "minimum": 0
                },
                "output": {
                  "type": "integer",
                  "minimum": 0
                }
              },
              "additionalProperties": false
            },
            "reasoningTokens": {
              "type": [
                "integer",
                "null"
              ],
              "minimum": 0
            },
            "serviceTier": {
              "type": [
                "string",
                "null"
              ],
              "enum": [
                "standard",
                "fast",
                null
              ]
            },
            "reportedCostUsd": {
              "type": [
                "number",
                "null"
              ],
              "minimum": 0
            }
          },
          "required": [
            "tokens"
          ],
          "additionalProperties": false
        }
      },
      "required": [
        "targetId",
        "promptId",
        "cli",
        "model",
        "effort",
        "appliedEffort",
        "effortHonored",
        "label",
        "status",
        "svgFile",
        "rawFile",
        "startedAt",
        "finishedAt",
        "durationMs",
        "svgBytes",
        "error",
        "usage"
      ],
      "additionalProperties": false
    },
    "PublicJudgement": {
      "description": "随调用内嵌的评审记录：主仓 docs/research/judge/judge.schema.json 去掉 contactSheet 与 judges[].rawFile；没有评审的调用不带此字段",
      "type": "object",
      "properties": {
        "schemaVersion": { "const": 1 },
        "subject": { "type": "object" },
        "rubric": { "type": "object" },
        "judges": {
          "type": "array",
          "items": {
            "type": "object",
            "properties": {
              "kind": { "enum": ["code", "ai"] },
              "id": { "type": "string" },
              "promptVersion": { "type": "integer", "minimum": 1 },
              "judgedAt": { "type": "string", "format": "date-time" },
              "durationMs": { "type": "integer", "minimum": 0 },
              "usage": { "description": "AI 层裁判的 token 用量，与 attempts[].usage 同形", "type": ["object", "null"] },
              "asks": { "type": "integer", "minimum": 1 }
            },
            "required": ["kind", "id", "judgedAt"],
            "additionalProperties": false
          }
        },
        "blindDescription": { "type": "string" },
        "gates": { "type": "array" },
        "criteria": { "type": "array" },
        "total": {
          "type": "object",
          "properties": {
            "score": { "type": "integer" },
            "maxScore": { "type": "integer" },
            "verdict": { "enum": ["online", "degraded", "pending"] },
            "judgedAt": { "type": "string", "format": "date-time" }
          },
          "required": ["score", "maxScore", "verdict"]
        }
      },
      "required": ["schemaVersion", "subject", "rubric", "judges", "gates", "criteria", "total"],
      "additionalProperties": false
    },
    "PublicProfile": {
      "type": "object",
      "properties": {
        "name": {
          "type": "string",
          "minLength": 1
        },
        "label": {
          "type": "string"
        },
        "cli": {
          "type": "string"
        },
        "upstreamType": {
          "type": "string"
        },
        "group": {
          "type": [
            "string",
            "null"
          ]
        },
        "multiplier": {
          "type": "number",
          "minimum": 0
        },
        "enabled": {
          "type": "boolean"
        }
      },
      "required": [
        "name",
        "label",
        "cli",
        "upstreamType",
        "group",
        "multiplier",
        "enabled"
      ],
      "additionalProperties": false,
      "description": "本轮调用用到的上游 profile 公开视图：七个字段，官网、接口地址、查询参数与 key 状态不发布"
    }
  }
}
