{
  "runId": "20261011T010000Z",
  "prompts": [
    {
      "promptId": "animated-pelican-v1",
      "text": "Generate an SVG of a California brown pelican riding a bicycle featuring pure inline SVG animation (using SMIL <animateTransform> or inline CSS @keyframes). The bicycle must have a correctly shaped frame, handlebar, saddle, spoked wheels, pedals, and crank arms. The pelican must be seated and pedaling the bicycle with its feet on the pedals. Animations must run smoothly and continuously in a modern browser: 1. Both front and rear wheels must continuously rotate around their respective axle center points (transform-origin). 2. The crank arms and pedals must smoothly revolve around the bottom bracket spindle. 3. The pelican's legs must smoothly animate up and down in synchrony with the pedaling motion. The entire output must be completely self-contained within a single valid SVG element (ensure strictly well-formed XML: if using <style>, wrap CSS inside <![CDATA[ ... ]]> or avoid raw unescaped '&' and '<'), requiring no external scripts or stylesheets.",
      "bindings": {}
    }
  ],
  "startedAt": "2026-10-11T01:00:00.017Z",
  "finishedAt": "2026-10-11T01:02:54.407Z",
  "durationMs": 174390,
  "trigger": "schedule",
  "harnessGuard": "Draw it directly in this single reply. Do not search the web or fetch anything online, do not run or test any code, and do not render, screenshot, or otherwise inspect your own output to check it. Output the final SVG straight away.",
  "publicSchemaVersion": 1,
  "inProgress": false,
  "attempts": [
    {
      "targetId": "agy__gemini-3.8-flash__low",
      "promptId": "animated-pelican-v1",
      "cli": "agy",
      "model": "gemini-3.8-flash",
      "effort": "low",
      "appliedEffort": "low",
      "effortHonored": true,
      "label": "Gemini 3.8 Flash · low",
      "status": "ok",
      "svgFile": "agy__gemini-3.8-flash__low__animated-pelican-v1.svg",
      "startedAt": "2026-10-11T01:00:11.236Z",
      "finishedAt": "2026-10-11T01:00:59.090Z",
      "durationMs": 47854,
      "svgBytes": 20893,
      "error": null,
      "usage": {
        "tokens": {
          "input": 13436,
          "output": 9361
        },
        "reasoningTokens": 0,
        "serviceTier": "standard",
        "reportedCostUsd": null
      },
      "rawFile": null
    },
    {
      "targetId": "agy__gemini-3.8-flash__high",
      "promptId": "animated-pelican-v1",
      "cli": "agy",
      "model": "gemini-3.8-flash",
      "effort": "high",
      "appliedEffort": "high",
      "effortHonored": true,
      "label": "Gemini 3.8 Flash · high",
      "status": "ok",
      "svgFile": "agy__gemini-3.8-flash__high__animated-pelican-v1.svg",
      "startedAt": "2026-10-11T01:00:59.091Z",
      "finishedAt": "2026-10-11T01:02:54.405Z",
      "durationMs": 115314,
      "svgBytes": 30187,
      "error": null,
      "usage": {
        "tokens": {
          "input": 13443,
          "output": 35874
        },
        "reasoningTokens": 21081,
        "serviceTier": "standard",
        "reportedCostUsd": null
      },
      "rawFile": null
    }
  ],
  "redactions": []
}
