{
  "runId": "20261001T060000Z",
  "prompts": [
    {
      "promptId": "animated-pelican-v1",
      "text": "Generate an SVG of a California brown pelican riding a bicycle featuring pure inline SVG animation (using SMIL <animateTransform> or inline CSS @keyframes). The bicycle must have a correctly shaped frame, handlebar, saddle, spoked wheels, pedals, and crank arms. The pelican must be seated and pedaling the bicycle with its feet on the pedals. Animations must run smoothly and continuously in a modern browser: 1. Both front and rear wheels must continuously rotate around their respective axle center points (transform-origin). 2. The crank arms and pedals must smoothly revolve around the bottom bracket spindle. 3. The pelican's legs must smoothly animate up and down in synchrony with the pedaling motion. The entire output must be completely self-contained within a single valid SVG element (ensure strictly well-formed XML: if using <style>, wrap CSS inside <![CDATA[ ... ]]> or avoid raw unescaped '&' and '<'), requiring no external scripts or stylesheets.",
      "bindings": {}
    },
    {
      "promptId": "landmarks-anim-v1",
      "text": "生成一幅 SVG 插画。【主体】马拉喀什的库图比亚清真寺，白天，宣礼塔连同祈祷厅与广场作为一件微缩模型。【结构】自下而上：① 底座上一片广场与玫瑰园，远端留出早期寺院的一排矮柱基遗址；② 低矮宽阔的祈祷厅，成排的绿色瓦坡屋顶并列，一侧是带净身泉与成排小树的方形庭院；③ 从祈祷厅一角升起一座方形的宣礼塔主塔身，四面各有一组不同的盲拱图案，用浅浮雕线条表现；④ 主塔身顶部一条白绿相间的瓷砖带，其上一圈阶梯状雉堞；⑤ 雉堞之内再立一座更小的方形小塔，四面有菱格纹板；⑥ 小塔顶上一个带竖向凹槽的小穹顶；⑦ 穹顶上串着三颗由大到小的金铜色圆球，旁边一根细杆。【比例】宣礼塔总高略大于底边的五倍；主塔身占总高约五分之四，小塔与穹顶占其余五分之一；小塔边长约为主塔身的一半；祈祷厅的屋脊高度不超过宣礼塔的六分之一，但占地宽度约为宣礼塔总高的一倍。【材质与色彩】塔身与祈祷厅墙体为赭红色砂岩与砖（建议 #b8664a），受光面偏橙，背光面偏紫褐；瓷砖带为白色配翠绿（建议 #2f8f6a）；祈祷厅屋顶为绿色瓦（建议 #3f7a4f）；圆球与尖饰为金铜色（建议 #c9962e）；广场地面为浅米色，玫瑰园为深绿配几点玫红。【环境与微缩细节】广场上点缀几棵高瘦的棕榈树，树高不超过主塔身的三分之一；玫瑰园用几块深绿色的圆角矩形表示，中间留出浅色小径；广场一角放一座极小的白色圆顶小屋。以下各段只规定画法。凡与【主体】【结构】【比例】【材质与色彩】【环境与微缩细节】五段有出入的，一律以那五段为准；不添加那五段没有写到的任何物件、材质或效果。【构图与镜头】把整座模型放在一块厚度可见的圆形展示底座上，底座顶面就是【环境与微缩细节】段描述的地面或水面，侧壁比顶面深一档，顶面外沿留一道细细的亮边；镜头取约 30° 俯视的四分之三视角，带轻微透视，让主体的两个面同时可见，若【主体】段指定了观看方向则以它为准；主体居中，最长的一边约占画面对应方向的 70%，底座占画面宽度约 80%。【光影与材质】光源在左上方约 45°，是柔和的漫射顶光。每个体块都分出受光、中间、背光三档明度，受光面顶边再提一道更亮的窄边，背光面底边压一道更暗的窄边。质感按【材质与色彩】段写的来，本段只规定明暗的做法：硬而光滑的表面高光集中成一条窄边，粗糙的表面高光散成一片；透明或反光的表面把上方物件的颜色压暗后映在下面；有砌缝、纹理、格纹这类表面细节时，只在受光面画出，背光面并入暗部。凡是悬出、凹进和两个构件相接的地方，用半透明深色形状压一层环境光遮蔽。主体按光源方向在地面上拖出一片柔和的投影，底座下方再画一个淡淡的椭圆投影。【远近层次】以主体所在的位置为基准分近、中、远：主体所在的那一层最实、对比最强；比主体更近的陈设颜色略深、边缘清楚；比主体更远的东西整体提亮、降低饱和度、边缘变软、不描轮廓，像隔着一层薄薄的空气。【微缩细节】只画【环境与微缩细节】段写到的陈设，不添加那里没有的东西；但写到的每一件都按可以凑近看的小模型来画：会动的东西带上它运动留下的痕迹，立着的东西有自己的小投影，有开口的东西在开口里留一点更深的暗部，成组的东西至少两种尺寸、散落而不排成阵。凡是【结构】或【环境与微缩细节】段写成一排、一圈、一片的重复构件，就成排铺满，不能画三个代表一排。尺寸上限以【比例】段为准。【氛围】时间、天气与季节以【主体】段为准，画面整体是一件放在安静陈列室里的模型：底座以外的背景只画自上而下由浅到更浅的柔和渐变，不画任何景物；模型比底座与背景更实、对比更强，让视线落在模型上；整体偏亮，最深的暗部也不发黑，而是带一点该处材质的颜色。【动态】主体建筑或地貌本身静止不动。到【环境与微缩细节】段里找现实中本来就会动的东西，只让这些东西动，动法就是它们在现实里的动法，幅度按微缩模型的尺度缩小；那一段没有写到的东西一律不画，不为了动画添加任何物件、光效或天气变化。如果该景没有会动的东西，就整幅静止，这不算缺陷。动画一律用 SMIL（<animate>、<animateTransform>、<animateMotion>）或写在 <style> 里的 CSS @keyframes 实现，每个循环 4 到 12 秒，缓入缓出，循环处不能有跳变；旋转与摇摆的中心必须落在该物件自身的轴点上，不能绕画布原点转；动画元素总数不超过十二个，其余保持静止。若使用 <style>，把 CSS 包在 <![CDATA[ ]]> 里，不出现未转义的 & 与 <。【风格与绘制技法】miniature diorama 微缩景观的玩具模型质感：体量来自明暗面而不是线描；轮廓线细而干净或不画。细节要密而有序，结构与比例必须准确，宁可多分一档明度，不要省成一块平色。用分层的简单形状堆叠建筑与地貌；渐变可用线性与径向；允许用 <filter> 做柔和投影与远处的轻微模糊；重复构件放进 <defs>，用 <use> 或 <pattern> 复用；不使用位图与外部引用。【禁止】文字、旗帜、徽记、标语、真实人物、JavaScript 与交互事件、圆形或多边形塔身、尖锥形塔顶、塔身上的文字铭文、新月标志。",
      "bindings": {
        "回目": "马拉喀什 库图比亚清真寺（动态）"
      }
    }
  ],
  "startedAt": "2026-10-01T06:00:00.020Z",
  "finishedAt": "2026-10-01T06:07:07.999Z",
  "durationMs": 427979,
  "trigger": "schedule",
  "publicSchemaVersion": 1,
  "inProgress": false,
  "attempts": [
    {
      "targetId": "agy__gemini-3.8-flash__low",
      "promptId": "animated-pelican-v1",
      "cli": "agy",
      "model": "gemini-3.8-flash",
      "effort": "low",
      "appliedEffort": "low",
      "effortHonored": true,
      "label": "Gemini 3.8 Flash · low",
      "status": "ok",
      "svgFile": "agy__gemini-3.8-flash__low__animated-pelican-v1.svg",
      "startedAt": "2026-10-01T06:00:11.940Z",
      "finishedAt": "2026-10-01T06:00:54.571Z",
      "durationMs": 42631,
      "svgBytes": 21809,
      "error": null,
      "usage": {
        "tokens": {
          "input": 13836,
          "output": 9760
        },
        "reasoningTokens": 0,
        "serviceTier": "standard",
        "reportedCostUsd": null
      },
      "rawFile": null
    },
    {
      "targetId": "agy__gemini-3.8-flash__high",
      "promptId": "animated-pelican-v1",
      "cli": "agy",
      "model": "gemini-3.8-flash",
      "effort": "high",
      "appliedEffort": "high",
      "effortHonored": true,
      "label": "Gemini 3.8 Flash · high",
      "status": "ok",
      "svgFile": "agy__gemini-3.8-flash__high__animated-pelican-v1.svg",
      "startedAt": "2026-10-01T06:02:02.839Z",
      "finishedAt": "2026-10-01T06:04:26.417Z",
      "durationMs": 143578,
      "svgBytes": 28564,
      "error": null,
      "usage": {
        "tokens": {
          "input": 13836,
          "output": 42098
        },
        "reasoningTokens": 28044,
        "serviceTier": "standard",
        "reportedCostUsd": null
      },
      "rawFile": null
    },
    {
      "targetId": "agy__gemini-3.8-flash__low",
      "promptId": "landmarks-anim-v1",
      "cli": "agy",
      "model": "gemini-3.8-flash",
      "effort": "low",
      "appliedEffort": "low",
      "effortHonored": true,
      "label": "Gemini 3.8 Flash · low",
      "status": "ok",
      "svgFile": "agy__gemini-3.8-flash__low__landmarks-anim-v1.svg",
      "startedAt": "2026-10-01T06:00:54.572Z",
      "finishedAt": "2026-10-01T06:02:02.838Z",
      "durationMs": 68266,
      "svgBytes": 35108,
      "error": null,
      "usage": {
        "tokens": {
          "input": 15218,
          "output": 15767
        },
        "reasoningTokens": 0,
        "serviceTier": "standard",
        "reportedCostUsd": null
      },
      "rawFile": null
    },
    {
      "targetId": "agy__gemini-3.8-flash__high",
      "promptId": "landmarks-anim-v1",
      "cli": "agy",
      "model": "gemini-3.8-flash",
      "effort": "high",
      "appliedEffort": "high",
      "effortHonored": true,
      "label": "Gemini 3.8 Flash · high",
      "status": "ok",
      "svgFile": "agy__gemini-3.8-flash__high__landmarks-anim-v1.svg",
      "startedAt": "2026-10-01T06:04:26.417Z",
      "finishedAt": "2026-10-01T06:07:07.996Z",
      "durationMs": 161579,
      "svgBytes": 39784,
      "error": null,
      "usage": {
        "tokens": {
          "input": 15212,
          "output": 44919
        },
        "reasoningTokens": 24665,
        "serviceTier": "standard",
        "reportedCostUsd": null
      },
      "rawFile": null
    }
  ],
  "redactions": []
}
