{
  "runId": "20260926T041323Z",
  "prompts": [
    {
      "promptId": "upgraded-v2",
      "text": "Generate an SVG of a California brown pelican riding a bicycle. The bicycle must have spokes and a correctly shaped bicycle frame. The pelican must have its characteristic large pouch, and there should be a clear indication of feathers. The pelican must be clearly pedaling the bicycle. The image should show the full breeding plumage of the California brown pelican.",
      "bindings": {}
    },
    {
      "promptId": "honglou-v1",
      "text": "生成一幅 SVG 插画，描绘《红楼梦》第八回宝玉与宝钗互看玉与金锁的场面：冬日，梨香院的里屋，面若银盆、眼如水杏的宝钗坐在炕上，衣着半新不旧、素雅不奢，托起颈上挂着的一把金锁细看；对面的宝玉解下一块五彩晶莹的美玉递过去，两人凑近比看，一旁的小丫鬟莺儿抿嘴偷笑。窗外飘着细雪。",
      "bindings": {
        "回目": "第8回 比通灵"
      }
    }
  ],
  "startedAt": "2026-09-26T04:13:23.615Z",
  "finishedAt": "2026-09-26T04:23:17.256Z",
  "durationMs": 593641,
  "trigger": "manual",
  "cancelledAt": "2026-09-26T04:23:17.256Z",
  "publicSchemaVersion": 1,
  "inProgress": false,
  "attempts": [
    {
      "targetId": "claude__claude-opus-5-5__low",
      "promptId": "upgraded-v2",
      "cli": "claude",
      "model": "claude-opus-5-5",
      "effort": "low",
      "appliedEffort": "low",
      "effortHonored": true,
      "label": "Claude Opus 5.5 · low",
      "status": "ok",
      "svgFile": "claude__claude-opus-5-5__low__upgraded-v2.svg",
      "startedAt": "2026-09-26T04:13:23.811Z",
      "finishedAt": "2026-09-26T04:14:17.395Z",
      "durationMs": 53584,
      "svgBytes": 7336,
      "error": null,
      "usage": {
        "tokens": {
          "input": 2,
          "cache_read": 10234,
          "output": 4880,
          "cache_write_1h": 10487
        },
        "reasoningTokens": 496,
        "serviceTier": "standard",
        "reportedCostUsd": 0.1835508
      },
      "rawFile": null
    },
    {
      "targetId": "claude__claude-opus-5-5__high",
      "promptId": "upgraded-v2",
      "cli": "claude",
      "model": "claude-opus-5-5",
      "effort": "high",
      "appliedEffort": "high",
      "effortHonored": true,
      "label": "Claude Opus 5.5 · high",
      "status": "ok",
      "svgFile": "claude__claude-opus-5-5__high__upgraded-v2.svg",
      "startedAt": "2026-09-26T04:15:21.100Z",
      "finishedAt": "2026-09-26T04:18:16.661Z",
      "durationMs": 175561,
      "svgBytes": 12110,
      "error": null,
      "usage": {
        "tokens": {
          "input": 2,
          "cache_read": 10234,
          "output": 15872,
          "cache_write_1h": 10487
        },
        "reasoningTokens": 8864,
        "serviceTier": "standard",
        "reportedCostUsd": 0.40339080000000005
      },
      "rawFile": null
    },
    {
      "targetId": "claude__claude-opus-5-5__low",
      "promptId": "honglou-v1",
      "cli": "claude",
      "model": "claude-opus-5-5",
      "effort": "low",
      "appliedEffort": "low",
      "effortHonored": true,
      "label": "Claude Opus 5.5 · low",
      "status": "ok",
      "svgFile": "claude__claude-opus-5-5__low__honglou-v1.svg",
      "startedAt": "2026-09-26T04:14:17.396Z",
      "finishedAt": "2026-09-26T04:15:21.099Z",
      "durationMs": 63703,
      "svgBytes": 10662,
      "error": null,
      "usage": {
        "tokens": {
          "input": 2,
          "cache_read": 10234,
          "output": 6374,
          "cache_write_1h": 8718
        },
        "reasoningTokens": 204,
        "serviceTier": "standard",
        "reportedCostUsd": 0.1992788
      },
      "rawFile": null
    },
    {
      "targetId": "claude__claude-opus-5-5__high",
      "promptId": "honglou-v1",
      "cli": "claude",
      "model": "claude-opus-5-5",
      "effort": "high",
      "appliedEffort": "high",
      "effortHonored": true,
      "label": "Claude Opus 5.5 · high",
      "status": "timeout",
      "svgFile": null,
      "startedAt": "2026-09-26T04:18:16.661Z",
      "finishedAt": "2026-09-26T04:23:17.247Z",
      "durationMs": 300586,
      "svgBytes": null,
      "error": "超过 300 秒未返回，已终止。该 CLI 的延迟可能随时段波动，可在配置的 run.timeoutByCli 或 run.timeoutByEffort 中单独调高",
      "usage": null,
      "rawFile": null
    }
  ],
  "redactions": []
}
