{
  "runId": "20260923T152537Z",
  "prompts": [
    {
      "promptId": "classic-v1",
      "text": "Generate an SVG of a pelican riding a bicycle",
      "bindings": {}
    },
    {
      "promptId": "animal-rotation-v1",
      "text": "Generate an SVG of a axolotl riding a bicycle",
      "bindings": {
        "animal": "axolotl",
        "vehicle": "bicycle"
      }
    }
  ],
  "startedAt": "2026-09-23T15:25:37.334Z",
  "finishedAt": "2026-09-23T15:28:24.001Z",
  "durationMs": 166667,
  "trigger": "manual",
  "publicSchemaVersion": 1,
  "inProgress": false,
  "attempts": [
    {
      "targetId": "agy__gemini-3.8-flash__max",
      "promptId": "classic-v1",
      "cli": "agy",
      "model": "gemini-3.8-flash",
      "effort": "max",
      "appliedEffort": "high",
      "effortHonored": false,
      "label": "Gemini 3.8 Flash · 请求 max",
      "status": "error",
      "svgFile": null,
      "startedAt": "2026-09-23T15:25:37.338Z",
      "finishedAt": "2026-09-23T15:25:51.279Z",
      "durationMs": 13941,
      "svgBytes": null,
      "error": "invalid model selection (--model \"gemini-3.8-flash\" --effort \"\"): --model gemini-3.8-flash requires --effort (available: low, medium, high)",
      "rawFile": null,
      "usage": null
    },
    {
      "targetId": "agy__claude-sonnet-4-6__low",
      "promptId": "classic-v1",
      "cli": "agy",
      "model": "claude-sonnet-4-6",
      "effort": "low",
      "appliedEffort": "low",
      "effortHonored": false,
      "label": "Claude Sonnet 4.6 (agy) · low",
      "status": "no-svg",
      "svgFile": null,
      "startedAt": "2026-09-23T15:25:37.338Z",
      "finishedAt": "2026-09-23T15:26:59.148Z",
      "durationMs": 81810,
      "svgBytes": null,
      "error": "输出中未找到成对的 <svg>…</svg>",
      "rawFile": null,
      "usage": null
    },
    {
      "targetId": "agy__gemini-3.8-flash__max",
      "promptId": "animal-rotation-v1",
      "cli": "agy",
      "model": "gemini-3.8-flash",
      "effort": "max",
      "appliedEffort": "high",
      "effortHonored": false,
      "label": "Gemini 3.8 Flash · 请求 max",
      "status": "error",
      "svgFile": null,
      "startedAt": "2026-09-23T15:25:51.279Z",
      "finishedAt": "2026-09-23T15:26:05.021Z",
      "durationMs": 13742,
      "svgBytes": null,
      "error": "invalid model selection (--model \"gemini-3.8-flash\" --effort \"\"): --model gemini-3.8-flash requires --effort (available: low, medium, high)",
      "rawFile": null,
      "usage": null
    },
    {
      "targetId": "agy__claude-sonnet-4-6__low",
      "promptId": "animal-rotation-v1",
      "cli": "agy",
      "model": "claude-sonnet-4-6",
      "effort": "low",
      "appliedEffort": "low",
      "effortHonored": false,
      "label": "Claude Sonnet 4.6 (agy) · low",
      "status": "no-svg",
      "svgFile": null,
      "startedAt": "2026-09-23T15:26:05.022Z",
      "finishedAt": "2026-09-23T15:28:24.001Z",
      "durationMs": 138979,
      "svgBytes": null,
      "error": "输出中未找到成对的 <svg>…</svg>",
      "rawFile": null,
      "usage": null
    }
  ],
  "redactions": []
}
