{
  "runId": "20260926T144332Z",
  "prompts": [
    {
      "promptId": "upgraded-v2",
      "text": "Generate an SVG of a California brown pelican riding a bicycle. The bicycle must have spokes and a correctly shaped bicycle frame. The pelican must have its characteristic large pouch, and there should be a clear indication of feathers. The pelican must be clearly pedaling the bicycle. The image should show the full breeding plumage of the California brown pelican.",
      "bindings": {}
    }
  ],
  "startedAt": "2026-09-26T14:43:32.719Z",
  "finishedAt": "2026-09-26T14:43:32.976Z",
  "durationMs": 257,
  "trigger": "manual",
  "publicSchemaVersion": 1,
  "inProgress": false,
  "attempts": [
    {
      "targetId": "agy__gemini-3.8-flash__low",
      "promptId": "upgraded-v2",
      "cli": "agy",
      "model": "gemini-3.8-flash",
      "effort": "low",
      "appliedEffort": "low",
      "effortHonored": true,
      "label": "Gemini 3.8 Flash · low",
      "status": "error",
      "svgFile": null,
      "startedAt": "2026-09-26T14:43:32.897Z",
      "finishedAt": "2026-09-26T14:43:32.897Z",
      "durationMs": 0,
      "svgBytes": null,
      "error": "预检未通过，未发起调用：agy 未登录。登录：docker exec -it llm-iq-dashboard pnpm onboard agy",
      "usage": null,
      "rawFile": null
    },
    {
      "targetId": "agy__gemini-3.8-flash__high",
      "promptId": "upgraded-v2",
      "cli": "agy",
      "model": "gemini-3.8-flash",
      "effort": "high",
      "appliedEffort": "high",
      "effortHonored": true,
      "label": "Gemini 3.8 Flash · high",
      "status": "error",
      "svgFile": null,
      "startedAt": "2026-09-26T14:43:32.897Z",
      "finishedAt": "2026-09-26T14:43:32.897Z",
      "durationMs": 0,
      "svgBytes": null,
      "error": "预检未通过，未发起调用：agy 未登录。登录：docker exec -it llm-iq-dashboard pnpm onboard agy",
      "usage": null,
      "rawFile": null
    }
  ],
  "redactions": []
}
