{
  "runId": "20260927T050213Z",
  "prompts": [
    {
      "promptId": "fe-ai-v1",
      "text": "Generate an SVG technical visualization of Rigid Body Oblique Multi-Impact & Restitution Impulse Phase Dynamics using pure inline SVG animation (SMIL or inline CSS keyframes, absolutely NO JavaScript or interactive event listeners). Context & Engineering Background: 物理世界模型（World Models，如 Sora-2、Genesis-Physics、Cosmos-World）的核心难题之一在于对多体刚体接触、冲击瞬态突变以及角动量非弹性耦合的因果准确推演。传统大模型视觉生成常出现反弹方向违反库仑摩擦定律、碰撞瞬间物体“穿模”或转速与线动量不守恒的幻觉。 Physical & Mathematical Ground Truth: 1. **冲量-动量守恒方程**: $$J = \\\\int_{t_0}^{t_1} F \\\\, dt = m(v^+ - v^-), \\\\quad J_\\\\tau = \\\\int_{t_0}^{t_1} (r \\\\times F) \\\\, dt = I(\\\\omega^+ - \\\\omega^-)$$ 2. **泊松/牛顿恢复系数与库仑干摩擦锥**: $$v_{rel, n}^+ = -e \\\\cdot v_{rel, n}^- \\\\quad (0 \\\\le e \\\\le 1)$$ $$|J_t| \\\\le \\\\mu J_n \\\\quad (\\\\text{黏着贴合}) \\\\quad \\\\text{或} \\\\quad J_t = -\\\\mu \\\\operatorname{sgn}(v_{rel, t}) J_n \\\\quad (\\\\text{滑动摩擦})$$ 3. **拓扑与状态参数**: 质心质量 $m=2.0\\\\,\\\\text{kg}$、转动惯量 $I=\\\\frac{1}{6}m L^2$ 的非对称多边形刚体以初速度 $v_0 = (4.0, -6.0)\\\\,\\\\text{m/s}$、角速度 $\\\\omega_0 = 2.5\\\\,\\\\text{rad/s}$ 撞击倾角 $15^\\\\circ$ 的刚性基座；恢复系数 $e=0.65$、静动摩擦系数 $\\\\mu=0.35$。 Visual Inspection Criteria: - **几何与动量自洽性**: 碰撞瞬时（$t_{contact}$），冲量矢量箭头垂直于局部碰撞法线与摩擦锥投影； - **反弹轨迹曲率**: 反弹后质心抛物线 $y(x)$ 严格符合重力加速度 $g=-9.8\\\\,\\\\text{m/s}^2$ 的二次曲线； - **角动量旋向突变**: 接触点相对质心的偏心力臂 $r \\\\times J$ 诱发的角速度跳变 $\\\\Delta \\\\omega$ 正负号与线动量损失在视觉上严格同步。 Ensure the output is strictly well-formed valid XML SVG: wrap any <style> CSS in CDATA, do NOT use consecutive hyphens '--' inside comments, avoid duplicate attributes on tags, and self-contain all elements.",
      "bindings": {
        "回目": "刚体多体斜碰撞与弹性恢复冲量相图"
      }
    },
    {
      "promptId": "fe-semi-v1",
      "text": "Generate an SVG technical visualization of ALD 4-Phase Self-Limiting Chemisorption & Monolayer Saturation Kinetics Cycle using pure inline SVG animation (SMIL or inline CSS keyframes, absolutely NO JavaScript or interactive event listeners). Context & Engineering Background: 在亚 2nm 晶体管的 GAA 360° 环绕栅极、超高深宽比 3D NAND 通孔和 DRAM 电容器电介质制造中，原子层沉积（ALD）是唯一能够实现原子级厚度精度（$< 0.1\\\\,\\\\text{nm}$）和 100% 共形台阶覆盖率的薄膜沉积工艺。经典三甲基铝（$\\\\text{Al(CH}_3)_3$, TMA）与水蒸气（$\\\\text{H}_2\\\\text{O}$）沉积氧化铝（$\\\\text{Al}_2\\\\text{O}_3$）是 ALD 领域最标杆的自限性（Self-limiting）表面反应过程，其每一循环均由严格有序的四个脉冲/吹扫工步构成。 Physical & Mathematical Ground Truth: 1. **反应四阶段时序（Four Reaction Phases）**： - **阶段 A（TMA 前驱体脉冲，Duration $t_1 = 1.0\\\\,\\\\text{s}$）**：TMA 分子气相扩散至表面，与基底表面活性羟基（$-\\\\text{OH}$）发生剧烈自限化学吸附： $$\\\\text{Al-OH}^* + \\\\text{Al(CH}_3)_3(g) \\\\to \\\\text{Al-O-Al(CH}_3)_2^* + \\\\text{CH}_4(g)\\\\uparrow$$ 释放甲烷气体并自终止，表面转变为被甲基（$-\\\\text{CH}_3$）覆盖钝化态（饱和覆盖度 $\\\\theta \\\\to 1$）。 - **阶段 B（惰性气体吹扫，Duration $t_2 = 1.0\\\\,\\\\text{s}$）**：高纯 $N_2$ 气流席卷反应腔室，迅速吹除多余未反应 TMA 分子及副产物 $\\\\text{CH}_4$。 - **阶段 C（氧化剂 $\\\\text{H}_2\\\\text{O}$ 脉冲，Duration $t_3 = 1.0\\\\,\\\\text{s}$）**：引入水蒸气分子，与表面甲基发生配体置换反应： $$\\\\text{Al-CH}_3^* + \\\\text{H}_2\\\\text{O}(g) \\\\to \\\\text{Al-OH}^* + \\\\text{CH}_4(g)\\\\uparrow$$ 生成坚固的 $\\\\text{Al-O-Al}$ 氧化层网格并重新使表面羟基化（Regenerated $-\\\\text{OH}$）。 - **阶段 D（二次惰性气体吹扫，Duration $t_4 = 1.0\\\\,\\\\text{s}$）**：二次 $N_2$ 吹扫排空残留水汽与甲烷，完成一整个沉积闭环。 2. **物理生长常数与方程**： - 反应温度窗口（ALD Window）：$150^\\\\circ\\\\text{C}\\\\text{–}300^\\\\circ\\\\text{C}$。 - 单循环生长厚度（Growth Per Cycle, GPC）：严格恒定为 $1.1\\\\,\\\\text{Å/cycle} = 0.11\\\\,\\\\text{nm/cycle}$。 - 朗缪尔自限吸附动力学：$\\\\frac{d\\\\theta}{dt} = k_{ads} P_{TMA}(1-\\\\theta) - k_{des}\\\\theta$（强化学吸附下 $k_{des} \\\\approx 0$）。 Visual Inspection Criteria: - **四阶段连续时间轴状态机**：底栏带有平滑移动的发光时间轴指示条，精准在 Phase A $\\\\to$ B $\\\\to$ C $\\\\to$ D 之间切换标签与颜色。 - **分子化学构型精准性**：TMA 分子（中心铝球 Al 键合 3 个对称甲基团 $\\\\text{CH}_3$）、水分子（弯曲型 $\\\\text{H}_2\\\\text{O}$，键角 $104.5^\\\\circ$）、副产物甲烷（四面体型 $\\\\text{CH}_4$ 向上飘逸挥发）。 - **原子层爬升可测量性**：经过完整一个四拍循环，底部固体薄膜的厚度刻度必须产生肉眼可见的微小增量（精确提升 $1.1\\\\,\\\\text{Å}$ 对应像素高度）。 Ensure the output is strictly well-formed valid XML SVG: wrap any <style> CSS in CDATA, do NOT use consecutive hyphens '--' inside comments, avoid duplicate attributes on tags, and self-contain all elements.",
      "bindings": {
        "回目": "原子层沉积（ALD）TMA/H2O 四阶段自限性化学吸附与表面羟基饱和动力学循环"
      }
    }
  ],
  "startedAt": "2026-09-27T05:02:13.887Z",
  "finishedAt": "2026-09-27T05:07:00.769Z",
  "durationMs": 286882,
  "trigger": "manual",
  "publicSchemaVersion": 1,
  "inProgress": false,
  "attempts": [
    {
      "targetId": "agy__gemini-3.8-flash__high",
      "promptId": "fe-ai-v1",
      "cli": "agy",
      "model": "gemini-3.8-flash",
      "effort": "high",
      "appliedEffort": "high",
      "effortHonored": true,
      "label": "Gemini 3.8 Flash · high",
      "status": "ok",
      "svgFile": "agy__gemini-3.8-flash__high__fe-ai-v1.svg",
      "startedAt": "2026-09-27T05:02:23.789Z",
      "finishedAt": "2026-09-27T05:04:39.627Z",
      "durationMs": 135838,
      "svgBytes": 31765,
      "error": null,
      "usage": {
        "tokens": {
          "input": 23321,
          "output": 42825
        },
        "reasoningTokens": 29296,
        "serviceTier": "standard",
        "reportedCostUsd": null
      },
      "rawFile": null
    },
    {
      "targetId": "agy__gemini-3.8-flash__high",
      "promptId": "fe-semi-v1",
      "cli": "agy",
      "model": "gemini-3.8-flash",
      "effort": "high",
      "appliedEffort": "high",
      "effortHonored": true,
      "label": "Gemini 3.8 Flash · high",
      "status": "ok",
      "svgFile": "agy__gemini-3.8-flash__high__fe-semi-v1.svg",
      "startedAt": "2026-09-27T05:04:39.627Z",
      "finishedAt": "2026-09-27T05:07:00.766Z",
      "durationMs": 141139,
      "svgBytes": 56328,
      "error": null,
      "usage": {
        "tokens": {
          "input": 23735,
          "output": 38137
        },
        "reasoningTokens": 13989,
        "serviceTier": "standard",
        "reportedCostUsd": null
      },
      "rawFile": null
    }
  ],
  "redactions": []
}
