{
  "runId": "20260930T050640Z",
  "prompts": [
    {
      "promptId": "animated-pelican-v1",
      "text": "Generate an SVG of a California brown pelican riding a bicycle featuring pure inline SVG animation (using SMIL <animateTransform> or inline CSS @keyframes). The bicycle must have a correctly shaped frame, handlebar, saddle, spoked wheels, pedals, and crank arms. The pelican must be seated and pedaling the bicycle with its feet on the pedals. Animations must run smoothly and continuously in a modern browser: 1. Both front and rear wheels must continuously rotate around their respective axle center points (transform-origin). 2. The crank arms and pedals must smoothly revolve around the bottom bracket spindle. 3. The pelican's legs must smoothly animate up and down in synchrony with the pedaling motion. The entire output must be completely self-contained within a single valid SVG element (ensure strictly well-formed XML: if using <style>, wrap CSS inside <![CDATA[ ... ]]> or avoid raw unescaped '&' and '<'), requiring no external scripts or stylesheets.",
      "bindings": {}
    },
    {
      "promptId": "landmarks-anim-v1",
      "text": "生成一幅 SVG 插画。【主体】纽约的自由女神像，白天，立像连同基座与小岛作为一件微缩模型。【结构】自下而上：① 一圈星形的低矮堡垒平台，十一个尖角向外伸出，平台边缘是灰色石墙；② 截头金字塔形的高基座，越往上越窄，分为下部的宽台、中部的主体与上部的柱廊层，柱廊层四面各有一排细柱与一圈观景平台；③ 身披长袍的女性立像，长袍从肩部垂到脚面，衣褶用几道长而流畅的竖向阴影表现，左脚微微向前迈出，脚下踩着断裂的锁链；④ 右臂高举一支火炬，手臂伸直，火炬由把手与火焰组成；⑤ 左臂弯曲抱一块长方形碑板贴在身侧，碑板表面留白；⑥ 头戴一顶带七道放射状光芒的冠冕，光芒等距分布，中央一道朝向正上方。【比例】立像与基座的高度大致相等；火炬顶端为全像最高点，高出头顶约三个头高；冠冕光芒长度约为头部高度的一倍；基座底边宽度约为立像高度的三分之一；星形平台的外径约为基座底边的三倍。【材质与色彩】立像通体青绿色铜锈（建议 #6fa891），受光面偏浅青，背光面偏深绿，衣褶用更深的青绿细条表现；火炬火焰为金色（建议 #e0b23b）；基座为灰褐色花岗岩（建议 #9c8f7d），带水平砌缝；星形平台为深灰色石墙，顶面为绿色草地。【环境与微缩细节】底座是一小块岛屿，岛面为绿色草地与浅色步道，四周环绕蓝色的海水；岛边点缀一座小码头与一艘白色渡轮；水面用几道浅色的弧线表现波纹，靠近岛岸处偏浅。以下各段只规定画法。凡与【主体】【结构】【比例】【材质与色彩】【环境与微缩细节】五段有出入的，一律以那五段为准；不添加那五段没有写到的任何物件、材质或效果。【构图与镜头】把整座模型放在一块厚度可见的圆形展示底座上，底座顶面就是【环境与微缩细节】段描述的地面或水面，侧壁比顶面深一档，顶面外沿留一道细细的亮边；镜头取约 30° 俯视的四分之三视角，带轻微透视，让主体的两个面同时可见，若【主体】段指定了观看方向则以它为准；主体居中，最长的一边约占画面对应方向的 70%，底座占画面宽度约 80%。【光影与材质】光源在左上方约 45°，是柔和的漫射顶光。每个体块都分出受光、中间、背光三档明度，受光面顶边再提一道更亮的窄边，背光面底边压一道更暗的窄边。质感按【材质与色彩】段写的来，本段只规定明暗的做法：硬而光滑的表面高光集中成一条窄边，粗糙的表面高光散成一片；透明或反光的表面把上方物件的颜色压暗后映在下面；有砌缝、纹理、格纹这类表面细节时，只在受光面画出，背光面并入暗部。凡是悬出、凹进和两个构件相接的地方，用半透明深色形状压一层环境光遮蔽。主体按光源方向在地面上拖出一片柔和的投影，底座下方再画一个淡淡的椭圆投影。【远近层次】以主体所在的位置为基准分近、中、远：主体所在的那一层最实、对比最强；比主体更近的陈设颜色略深、边缘清楚；比主体更远的东西整体提亮、降低饱和度、边缘变软、不描轮廓，像隔着一层薄薄的空气。【微缩细节】只画【环境与微缩细节】段写到的陈设，不添加那里没有的东西；但写到的每一件都按可以凑近看的小模型来画：会动的东西带上它运动留下的痕迹，立着的东西有自己的小投影，有开口的东西在开口里留一点更深的暗部，成组的东西至少两种尺寸、散落而不排成阵。凡是【结构】或【环境与微缩细节】段写成一排、一圈、一片的重复构件，就成排铺满，不能画三个代表一排。尺寸上限以【比例】段为准。【氛围】时间、天气与季节以【主体】段为准，画面整体是一件放在安静陈列室里的模型：底座以外的背景只画自上而下由浅到更浅的柔和渐变，不画任何景物；模型比底座与背景更实、对比更强，让视线落在模型上；整体偏亮，最深的暗部也不发黑，而是带一点该处材质的颜色。【动态】主体建筑或地貌本身静止不动。到【环境与微缩细节】段里找现实中本来就会动的东西，只让这些东西动，动法就是它们在现实里的动法，幅度按微缩模型的尺度缩小；那一段没有写到的东西一律不画，不为了动画添加任何物件、光效或天气变化。如果该景没有会动的东西，就整幅静止，这不算缺陷。动画一律用 SMIL（<animate>、<animateTransform>、<animateMotion>）或写在 <style> 里的 CSS @keyframes 实现，每个循环 4 到 12 秒，缓入缓出，循环处不能有跳变；旋转与摇摆的中心必须落在该物件自身的轴点上，不能绕画布原点转；动画元素总数不超过十二个，其余保持静止。若使用 <style>，把 CSS 包在 <![CDATA[ ]]> 里，不出现未转义的 & 与 <。【风格与绘制技法】miniature diorama 微缩景观的玩具模型质感：体量来自明暗面而不是线描；轮廓线细而干净或不画。细节要密而有序，结构与比例必须准确，宁可多分一档明度，不要省成一块平色。用分层的简单形状堆叠建筑与地貌；渐变可用线性与径向；允许用 <filter> 做柔和投影与远处的轻微模糊；重复构件放进 <defs>，用 <use> 或 <pattern> 复用；不使用位图与外部引用。【禁止】文字、旗帜、徽记、标语、真实人物、JavaScript 与交互事件、左右手持物互换、金色或红棕色像身、圆柱形基座、可辨认的真实人物面容、碑板上的文字。",
      "bindings": {
        "回目": "纽约 自由女神像（动态）"
      }
    }
  ],
  "startedAt": "2026-09-30T05:06:40.819Z",
  "finishedAt": "2026-09-30T05:12:29.599Z",
  "durationMs": 348780,
  "trigger": "manual",
  "cancelledAt": "2026-09-30T05:12:29.599Z",
  "publicSchemaVersion": 1,
  "inProgress": false,
  "attempts": [
    {
      "targetId": "claude__claude-sonnet-5-5__low",
      "promptId": "animated-pelican-v1",
      "cli": "claude",
      "model": "claude-sonnet-5-5",
      "effort": "low",
      "appliedEffort": "low",
      "effortHonored": true,
      "label": "Claude Sonnet 5.5 · low",
      "status": "ok",
      "svgFile": "claude__claude-sonnet-5-5__low__animated-pelican-v1.svg",
      "startedAt": "2026-09-30T05:06:41.257Z",
      "finishedAt": "2026-09-30T05:07:24.018Z",
      "durationMs": 42761,
      "svgBytes": 5195,
      "error": null,
      "usage": {
        "tokens": {
          "input": 2,
          "cache_read": 3383,
          "output": 5145,
          "cache_write_1h": 6376
        },
        "reasoningTokens": 2352,
        "serviceTier": "standard",
        "reportedCostUsd": 0.38563575000000005
      },
      "rawFile": null
    },
    {
      "targetId": "claude__claude-sonnet-5-5__high",
      "promptId": "animated-pelican-v1",
      "cli": "claude",
      "model": "claude-sonnet-5-5",
      "effort": "high",
      "appliedEffort": "high",
      "effortHonored": true,
      "label": "Claude Sonnet 5.5 · high",
      "status": "ok",
      "svgFile": "claude__claude-sonnet-5-5__high__animated-pelican-v1.svg",
      "startedAt": "2026-09-30T05:10:04.505Z",
      "finishedAt": "2026-09-30T05:12:29.591Z",
      "durationMs": 145086,
      "svgBytes": 9214,
      "error": null,
      "usage": {
        "tokens": {
          "input": 2,
          "cache_read": 3383,
          "output": 18635,
          "cache_write_1h": 6376
        },
        "reasoningTokens": 13553,
        "serviceTier": "standard",
        "reportedCostUsd": 1.06013575
      },
      "rawFile": null
    },
    {
      "targetId": "claude__claude-sonnet-5-5__low",
      "promptId": "landmarks-anim-v1",
      "cli": "claude",
      "model": "claude-sonnet-5-5",
      "effort": "low",
      "appliedEffort": "low",
      "effortHonored": true,
      "label": "Claude Sonnet 5.5 · low",
      "status": "ok",
      "svgFile": "claude__claude-sonnet-5-5__low__landmarks-anim-v1.svg",
      "startedAt": "2026-09-30T05:07:24.019Z",
      "finishedAt": "2026-09-30T05:10:04.505Z",
      "durationMs": 160486,
      "svgBytes": 16883,
      "error": null,
      "usage": {
        "tokens": {
          "input": 2,
          "cache_read": 3383,
          "output": 20845,
          "cache_write_1h": 8349
        },
        "reasoningTokens": 11397,
        "serviceTier": "standard",
        "reportedCostUsd": 1.2100957499999998
      },
      "rawFile": null
    }
  ],
  "redactions": []
}
