{
  "runId": "20260926T025050Z",
  "prompts": [
    {
      "promptId": "sanguo-v1",
      "text": "生成一幅 SVG 插画，描绘《三国演义》第九十五回“空城计”的场面：西城城楼上，诸葛亮头戴纶巾、身披鹤氅，倚着栏杆焚香抚琴，左边童子捧着宝剑，右边童子拿着拂尘。城下四门大开，旌旗全都收起，几名扮成百姓的士兵低头洒扫街道。城外远处，司马懿骑在马上勒马观望，满脸疑虑，身后大军停步不前。",
      "bindings": {
        "回目": "第95回 空城计"
      }
    }
  ],
  "startedAt": "2026-09-26T02:50:50.810Z",
  "finishedAt": "2026-09-26T02:52:31.575Z",
  "durationMs": 100765,
  "trigger": "manual",
  "publicSchemaVersion": 1,
  "inProgress": false,
  "attempts": [
    {
      "targetId": "agy__gemini-3.8-flash__low",
      "promptId": "sanguo-v1",
      "cli": "agy",
      "model": "gemini-3.8-flash",
      "effort": "low",
      "appliedEffort": "low",
      "effortHonored": true,
      "label": "Gemini 3.8 Flash · low",
      "status": "ok",
      "svgFile": "agy__gemini-3.8-flash__low__sanguo-v1.svg",
      "startedAt": "2026-09-26T02:51:06.249Z",
      "finishedAt": "2026-09-26T02:52:31.433Z",
      "durationMs": 85184,
      "svgBytes": 35572,
      "error": null,
      "usage": {
        "tokens": {
          "input": 13792,
          "output": 18946
        },
        "reasoningTokens": 953,
        "serviceTier": "standard",
        "reportedCostUsd": null
      },
      "rawFile": null
    }
  ],
  "redactions": []
}
