{
  "runId": "20261003T074214Z",
  "prompts": [
    {
      "promptId": "animated-pelican-v1",
      "text": "Generate an SVG of a California brown pelican riding a bicycle featuring pure inline SVG animation (using SMIL <animateTransform> or inline CSS @keyframes). The bicycle must have a correctly shaped frame, handlebar, saddle, spoked wheels, pedals, and crank arms. The pelican must be seated and pedaling the bicycle with its feet on the pedals. Animations must run smoothly and continuously in a modern browser: 1. Both front and rear wheels must continuously rotate around their respective axle center points (transform-origin). 2. The crank arms and pedals must smoothly revolve around the bottom bracket spindle. 3. The pelican's legs must smoothly animate up and down in synchrony with the pedaling motion. The entire output must be completely self-contained within a single valid SVG element (ensure strictly well-formed XML: if using <style>, wrap CSS inside <![CDATA[ ... ]]> or avoid raw unescaped '&' and '<'), requiring no external scripts or stylesheets.",
      "bindings": {}
    }
  ],
  "startedAt": "2026-10-03T07:42:14.081Z",
  "finishedAt": "2026-10-03T07:44:29.970Z",
  "durationMs": 135889,
  "trigger": "manual",
  "harnessGuard": "Draw it directly in this single reply. Do not search the web or fetch anything online, do not run or test any code, and do not render, screenshot, or otherwise inspect your own output to check it. Output the final SVG straight away.",
  "publicSchemaVersion": 1,
  "inProgress": false,
  "attempts": [
    {
      "targetId": "claude__claude-sonnet-5-5__high",
      "promptId": "animated-pelican-v1",
      "cli": "claude",
      "model": "claude-sonnet-5-5",
      "effort": "high",
      "appliedEffort": "high",
      "effortHonored": true,
      "label": "Claude Sonnet 5.5 · high",
      "status": "ok",
      "svgFile": "claude__claude-sonnet-5-5__high__animated-pelican-v1.svg",
      "startedAt": "2026-10-03T07:42:14.329Z",
      "finishedAt": "2026-10-03T07:44:25.999Z",
      "durationMs": 131670,
      "svgBytes": 9643,
      "error": null,
      "usage": {
        "tokens": {
          "input": 2,
          "cache_read": 3387,
          "output": 15291,
          "cache_write_1h": 6447
        },
        "reasoningTokens": 10141,
        "serviceTier": "standard",
        "reportedCostUsd": 0.35808140000000005
      },
      "rawFile": null,
      "judge": {
        "schemaVersion": 1,
        "subject": {
          "runId": "20261003T074214Z",
          "attemptKey": "claude__claude-sonnet-5-5__high__animated-pelican-v1",
          "promptId": "animated-pelican-v1",
          "cli": "claude",
          "model": "claude-sonnet-5-5",
          "effort": "high",
          "svgFile": "claude__claude-sonnet-5-5__high__animated-pelican-v1.svg",
          "svgSha256": "a850e87c0d1557b7631b78d9cf7e08dfd32f61d42bd61d1490942fc84e31faf2"
        },
        "rubric": {
          "id": "animated-pelican-v1",
          "version": 1,
          "passThreshold": 78
        },
        "gates": [
          {
            "id": "G1",
            "source": "static",
            "title": "XML 合法",
            "standard": "XML 解析零错误",
            "passed": true,
            "evidence": "XML 解析无错误"
          },
          {
            "id": "G2",
            "source": "static",
            "title": "写了动画",
            "standard": "存在 <animate*>，或 <style> 内同时有 @keyframes 与 animation",
            "passed": true,
            "evidence": "SMIL 动画 11 个，CSS 动画 0 个"
          },
          {
            "id": "G3",
            "source": "static",
            "title": "自包含且无脚本",
            "standard": "无 <script>、<foreignObject>、外部引用、内嵌位图",
            "passed": true,
            "evidence": "无脚本、外部引用与位图"
          },
          {
            "id": "G4",
            "source": "render",
            "title": "确实在动",
            "standard": "8 帧两两像素差的最大值超过阈值",
            "passed": true,
            "evidence": "8 帧里 7 帧与首帧不同"
          },
          {
            "id": "G5",
            "source": "render",
            "title": "不出画布",
            "standard": "每一帧的内容包围盒都在 viewBox 内",
            "passed": true,
            "evidence": "3 个部件全程在画布内"
          }
        ],
        "criteria": [
          {
            "id": "C1",
            "source": "render",
            "title": "车轮绕轴心旋转",
            "standard": "前后车轮各绕自身轴心旋转：旋转中心与轮子圆心一致，逐帧位置不漂移；绕全局 (0,0) 或其他点旋转为零分",
            "maxScore": 10,
            "score": 10,
            "reason": "g 旋转中心偏离圆心 0.0，半径 67.0；渲染：wheel1 轮心漂移 0.0，wheel2 轮心漂移 0.0"
          },
          {
            "id": "C2",
            "source": "render",
            "title": "曲柄绕五通旋转",
            "standard": "曲柄与脚踏绕五通中心旋转，两脚踏相位相差 180°；曲柄不转或绕错中心为零分",
            "maxScore": 8,
            "score": 8,
            "reason": "g 五通 (390, 360) 在两轮之间；曲柄组内无圆，按位置判；渲染：曲柄量测点漂移 0.0（包围盒对角线 54.1）"
          },
          {
            "id": "C3",
            "source": "render",
            "title": "循环播放",
            "standard": "repeatCount=\"indefinite\" 或 infinite，首帧与末帧接近；只播放一次或末帧跳变为零分",
            "maxScore": 4,
            "score": 4,
            "reason": "3 个旋转动画都是 indefinite / infinite；渲染：t=2400ms 各部件回到首帧位置，循环闭合"
          },
          {
            "id": "C4",
            "source": "render",
            "title": "腿与曲柄同步",
            "standard": "腿部动画周期与曲柄周期相等或成整数倍，且渲染后脚（腿的末端）每帧都落在脚踏上；腿不动、周期无关或脚离开脚踏一段曲柄臂为零分",
            "maxScore": 8,
            "score": 8,
            "reason": "path 周期 2400ms 与曲柄 2400ms 同步；渲染：leg1 脚踏点离腿的距离最多变了 1.4，leg3 脚踏点离腿的距离最多变了 2.4（曲柄伸出 60.5，脚始终跟着脚踏）"
          },
          {
            "id": "C5",
            "source": "ai",
            "title": "自行车结构完整",
            "standard": "车架、车把、座垫、辐条轮、脚踏、曲柄齐全且形状正确；只有轮子或缺少主要部件为零分",
            "maxScore": 10,
            "score": 10,
            "reason": "车架、车把、座垫、辐条轮、曲柄和脚踏等部件均完整且结构比例标准正确。"
          },
          {
            "id": "C6",
            "source": "ai",
            "title": "主体是鹈鹕",
            "standard": "盲描述能认出鹈鹕（长喙、喉囊）；认成其他鸟或无法辨认为零分",
            "maxScore": 10,
            "score": 10,
            "reason": "头部具有标志性的长喙与膨大喉囊，羽色与形态特征鲜明，盲描述可明确确认为鹈鹕。"
          },
          {
            "id": "C7",
            "source": "ai",
            "title": "坐在座垫上、脚在脚踏上",
            "standard": "鹈鹕坐在座垫上，双脚落在脚踏上；悬空、脱离车身或脚不在脚踏上为零分",
            "maxScore": 10,
            "score": 10,
            "reason": "第1-8帧中鹈鹕臀部紧贴座垫无悬空，双脚全程准确踩在对应旋转的脚踏上。"
          },
          {
            "id": "C8",
            "source": "ai",
            "title": "踩踏动作可信",
            "standard": "8 帧连看，腿的伸缩与脚踏位置对应；腿与脚踏各动各的为零分",
            "maxScore": 20,
            "score": 20,
            "reason": "8帧连续观察中，双腿随曲柄做平滑的伸缩屈膝交替，与脚踏的圆周运动严格同步。"
          },
          {
            "id": "C9",
            "source": "ai",
            "title": "翅膀扶住车把",
            "standard": "鹈鹕的翅膀（前肢）搭在车把上，像在扶着车把骑行；翅膀收在身侧、够不着车把或没有车把可扶为零分",
            "maxScore": 20,
            "score": 20,
            "reason": "第1-8帧中翅膀均向前伸展平稳搭在车把顶端，呈现真实握把骑行姿态。"
          }
        ],
        "total": {
          "score": 100,
          "maxScore": 100,
          "verdict": "online",
          "judgedAt": "2026-10-03T07:48:35.368Z"
        },
        "blindDescription": "画面主体是一只鹈鹕，它正骑着一辆红色自行车在公路上蹬踏脚踏板前行。",
        "judges": [
          {
            "kind": "code",
            "id": "static-judge@1",
            "judgedAt": "2026-10-03T07:44:26.000Z",
            "durationMs": 130
          },
          {
            "kind": "code",
            "id": "render-judge@1",
            "judgedAt": "2026-10-03T07:44:29.881Z",
            "durationMs": 3431
          },
          {
            "kind": "ai",
            "promptVersion": 1,
            "id": "agy/gemini-3.8-flash@high",
            "judgedAt": "2026-10-03T07:48:35.368Z",
            "durationMs": 245393,
            "usage": {
              "tokens": {
                "input": 123407,
                "output": 50434,
                "cache_read": 109788
              },
              "reasoningTokens": 49338,
              "serviceTier": "standard",
              "reportedCostUsd": null
            },
            "asks": 3
          }
        ]
      }
    }
  ],
  "redactions": []
}
