{
  "runId": "20260923T072243Z",
  "prompts": [
    {
      "promptId": "classic-v1",
      "text": "Generate an SVG of a pelican riding a bicycle",
      "bindings": {}
    },
    {
      "promptId": "animal-rotation-v1",
      "text": "Generate an SVG of a pelican riding a bicycle",
      "bindings": {
        "animal": "pelican",
        "vehicle": "bicycle"
      }
    }
  ],
  "startedAt": "2026-09-23T07:22:43.428Z",
  "finishedAt": "2026-09-23T07:31:51.475Z",
  "durationMs": 548047,
  "trigger": "manual",
  "publicSchemaVersion": 1,
  "inProgress": false,
  "attempts": [
    {
      "targetId": "agy__gemini-3.8-flash-low__max",
      "promptId": "classic-v1",
      "cli": "agy",
      "model": "gemini-3.8-flash-low",
      "effort": "max",
      "appliedEffort": "high",
      "label": "Gemini 3.8 Flash · 请求 max",
      "status": "error",
      "svgFile": null,
      "startedAt": "2026-09-23T07:22:43.431Z",
      "finishedAt": "2026-09-23T07:22:55.921Z",
      "durationMs": 12490,
      "svgBytes": null,
      "error": "CLI 以退出码 1 结束，且输出中无 SVG",
      "effortHonored": true,
      "rawFile": null,
      "usage": null
    },
    {
      "targetId": "codex__gpt-6-astra__low",
      "promptId": "classic-v1",
      "cli": "codex",
      "model": "gpt-6-astra",
      "effort": "low",
      "appliedEffort": "low",
      "label": "Codex gpt-6-astra · low",
      "status": "timeout",
      "svgFile": null,
      "startedAt": "2026-09-23T07:22:43.431Z",
      "finishedAt": "2026-09-23T07:31:51.475Z",
      "durationMs": 548044,
      "svgBytes": null,
      "error": "超过 420000ms 未返回，已终止进程组",
      "effortHonored": true,
      "rawFile": null,
      "usage": null
    },
    {
      "targetId": "agy__gemini-3.8-flash-low__max",
      "promptId": "animal-rotation-v1",
      "cli": "agy",
      "model": "gemini-3.8-flash-low",
      "effort": "max",
      "appliedEffort": "high",
      "label": "Gemini 3.8 Flash · 请求 max",
      "status": "error",
      "svgFile": null,
      "startedAt": "2026-09-23T07:22:55.921Z",
      "finishedAt": "2026-09-23T07:23:10.799Z",
      "durationMs": 14878,
      "svgBytes": null,
      "error": "CLI 以退出码 1 结束，且输出中无 SVG",
      "effortHonored": true,
      "rawFile": null,
      "usage": null
    },
    {
      "targetId": "codex__gpt-6-astra__low",
      "promptId": "animal-rotation-v1",
      "cli": "codex",
      "model": "gpt-6-astra",
      "effort": "low",
      "appliedEffort": "low",
      "label": "Codex gpt-6-astra · low",
      "status": "timeout",
      "svgFile": null,
      "startedAt": "2026-09-23T07:23:10.799Z",
      "finishedAt": "2026-09-23T07:31:51.475Z",
      "durationMs": 520676,
      "svgBytes": null,
      "error": "超过 420000ms 未返回，已终止进程组",
      "effortHonored": true,
      "rawFile": null,
      "usage": null
    }
  ],
  "redactions": []
}
