{
  "runId": "20260926T030035Z",
  "prompts": [
    {
      "promptId": "classic-v1",
      "text": "Generate an SVG of a pelican riding a bicycle",
      "bindings": {}
    }
  ],
  "startedAt": "2026-09-26T03:00:35.402Z",
  "finishedAt": "2026-09-26T03:00:55.846Z",
  "durationMs": 20444,
  "trigger": "manual",
  "publicSchemaVersion": 1,
  "inProgress": false,
  "attempts": [
    {
      "targetId": "claude__claude-sonnet-5__low",
      "promptId": "classic-v1",
      "cli": "claude",
      "model": "claude-sonnet-5",
      "effort": "low",
      "appliedEffort": "low",
      "effortHonored": true,
      "label": "Claude Sonnet 5 · low",
      "status": "ok",
      "svgFile": "claude__claude-sonnet-5__low__classic-v1.svg",
      "startedAt": "2026-09-26T03:00:35.554Z",
      "finishedAt": "2026-09-26T03:00:55.842Z",
      "durationMs": 20288,
      "svgBytes": 3352,
      "error": null,
      "usage": {
        "tokens": {
          "input": 2,
          "cache_read": 18531,
          "output": 1905,
          "cache_write_1h": 9255
        },
        "reasoningTokens": 0,
        "serviceTier": "standard",
        "reportedCostUsd": 0.0597802
      },
      "rawFile": null
    }
  ],
  "redactions": []
}
