{
  "runId": "20260923T064600Z",
  "startedAt": "2026-09-23T06:46:00.003Z",
  "finishedAt": "2026-09-23T06:46:50.978Z",
  "durationMs": 50975,
  "trigger": "schedule",
  "prompts": [
    {
      "promptId": "classic-v1",
      "text": "Generate an SVG of a pelican riding a bicycle",
      "bindings": {}
    }
  ],
  "publicSchemaVersion": 1,
  "inProgress": false,
  "attempts": [
    {
      "targetId": "agy__gemini-3.8-flash-low__low",
      "cli": "agy",
      "model": "gemini-3.8-flash-low",
      "effort": "low",
      "label": "Gemini 3.8 Flash · low",
      "status": "ok",
      "svgFile": "agy__gemini-3.8-flash-low__low.svg",
      "startedAt": "2026-09-23T06:46:00.007Z",
      "finishedAt": "2026-09-23T06:46:50.978Z",
      "durationMs": 50971,
      "svgBytes": 143,
      "error": null,
      "promptId": "classic-v1",
      "appliedEffort": "low",
      "effortHonored": true,
      "rawFile": null,
      "usage": null
    }
  ],
  "redactions": []
}
