{
  "runId": "20260926T064108Z",
  "prompts": [
    {
      "promptId": "classic-v1",
      "text": "Generate an SVG of a pelican riding a bicycle",
      "bindings": {}
    }
  ],
  "startedAt": "2026-09-26T06:41:08.913Z",
  "finishedAt": "2026-09-26T06:41:55.718Z",
  "durationMs": 46805,
  "trigger": "manual",
  "publicSchemaVersion": 1,
  "inProgress": false,
  "attempts": [
    {
      "targetId": "claude__claude-opus-5-5__low",
      "promptId": "classic-v1",
      "cli": "claude",
      "model": "claude-opus-5-5",
      "effort": "low",
      "appliedEffort": "low",
      "effortHonored": true,
      "label": "Claude Opus 5.5 · low",
      "status": "ok",
      "svgFile": "claude__claude-opus-5-5__low__classic-v1.svg",
      "startedAt": "2026-09-26T06:41:16.068Z",
      "finishedAt": "2026-09-26T06:41:32.091Z",
      "durationMs": 16023,
      "svgBytes": 1728,
      "error": null,
      "usage": {
        "tokens": {
          "input": 2,
          "cache_read": 10234,
          "output": 988,
          "cache_write_1h": 8777
        },
        "reasoningTokens": 0,
        "serviceTier": "standard",
        "reportedCostUsd": 0.0920308
      },
      "rawFile": null
    },
    {
      "targetId": "agy__gemini-3.8-flash__low",
      "promptId": "classic-v1",
      "cli": "agy",
      "model": "gemini-3.8-flash",
      "effort": "low",
      "appliedEffort": "low",
      "effortHonored": true,
      "label": "Gemini 3.8 Flash · low",
      "status": "ok",
      "svgFile": "agy__gemini-3.8-flash__low__classic-v1.svg",
      "startedAt": "2026-09-26T06:41:16.069Z",
      "finishedAt": "2026-09-26T06:41:55.711Z",
      "durationMs": 39642,
      "svgBytes": 18686,
      "error": null,
      "usage": {
        "tokens": {
          "input": 13662,
          "output": 9748
        },
        "reasoningTokens": 420,
        "serviceTier": "standard",
        "reportedCostUsd": null
      },
      "rawFile": null
    }
  ],
  "redactions": []
}
