{
  "runId": "20260926T061238Z",
  "prompts": [
    {
      "promptId": "xiyou-v1",
      "text": "生成一幅 SVG 插画，描绘《西游记》第六十一回扇灭火焰山的场面：八百里火焰山烈焰冲天、寸草不生。头戴金箍、腰围虎皮裙的孙悟空站在山前，双手抡动一柄比人还高的巨大芭蕉扇；扇过之处火焰熄灭，乌云翻滚、大雨倾盆，一半画面仍是火海，一半已被雨水浇灭。",
      "bindings": {
        "回目": "第61回 扇灭火焰山"
      }
    }
  ],
  "startedAt": "2026-09-26T06:12:38.954Z",
  "finishedAt": "2026-09-26T06:15:20.213Z",
  "durationMs": 161259,
  "trigger": "manual",
  "publicSchemaVersion": 1,
  "inProgress": false,
  "attempts": [
    {
      "targetId": "agy__gemini-3.8-flash__high",
      "promptId": "xiyou-v1",
      "cli": "agy",
      "model": "gemini-3.8-flash",
      "effort": "high",
      "appliedEffort": "high",
      "effortHonored": true,
      "label": "Gemini 3.8 Flash · high",
      "status": "ok",
      "svgFile": "agy__gemini-3.8-flash__high__xiyou-v1.svg",
      "startedAt": "2026-09-26T06:12:46.421Z",
      "finishedAt": "2026-09-26T06:15:20.209Z",
      "durationMs": 153788,
      "svgBytes": 45349,
      "error": null,
      "usage": {
        "tokens": {
          "input": 13765,
          "output": 38148
        },
        "reasoningTokens": 16161,
        "serviceTier": "standard",
        "reportedCostUsd": null
      },
      "rawFile": null
    }
  ],
  "redactions": []
}
