{
  "runId": "20260927T022209Z",
  "prompts": [
    {
      "promptId": "mobius-strip-v1",
      "text": "Generate an animated SVG depicting a stylized vehicle (or rover) continuously cruising along an impossible-looking 3D Möbius strip track using pure inline SVG animation (SMIL or CSS keyframes). The Möbius strip ribbon must be rendered with dimensional shading, gradients, and perspective depth showing its continuous single-sided half-twist topology. The vehicle must travel at a steady speed along the centerline ribbon path and strictly demonstrate true non-orientable topological navigation: 1. In the first 360° circuit, the vehicle drives along what appears to be the 'outer' surface, passes smoothly through the half-twist region, and emerges on the 'inner' inverted surface (upside down). 2. In the second 360° circuit (completing a full 720° topological traversal), the inverted vehicle traverses the ribbon, passes through the twist once more, and smoothly flips back right-side up to its initial orientation. 3. The vehicle and track must exhibit correct foreground-versus-background layer occlusion as it moves across overlapping ribbon segments. Ensure the output is strictly well-formed valid XML SVG: wrap any <style> CSS in CDATA, do NOT use consecutive hyphens '--' inside comments, avoid duplicate attributes on tags, and self-contain all elements.",
      "bindings": {}
    }
  ],
  "startedAt": "2026-09-27T02:22:09.425Z",
  "finishedAt": "2026-09-27T02:26:03.587Z",
  "durationMs": 234162,
  "trigger": "manual",
  "publicSchemaVersion": 1,
  "inProgress": false,
  "attempts": [
    {
      "targetId": "agy__gemini-3.8-flash__low",
      "promptId": "mobius-strip-v1",
      "cli": "agy",
      "model": "gemini-3.8-flash",
      "effort": "low",
      "appliedEffort": "low",
      "effortHonored": true,
      "label": "Gemini 3.8 Flash · low",
      "status": "ok",
      "svgFile": "agy__gemini-3.8-flash__low__mobius-strip-v1.svg",
      "startedAt": "2026-09-27T02:22:23.950Z",
      "finishedAt": "2026-09-27T02:23:03.933Z",
      "durationMs": 39983,
      "svgBytes": 15531,
      "error": null,
      "usage": {
        "tokens": {
          "input": 22922,
          "output": 6330
        },
        "reasoningTokens": 0,
        "serviceTier": "standard",
        "reportedCostUsd": null
      },
      "rawFile": null
    },
    {
      "targetId": "agy__gemini-3.8-flash__high",
      "promptId": "mobius-strip-v1",
      "cli": "agy",
      "model": "gemini-3.8-flash",
      "effort": "high",
      "appliedEffort": "high",
      "effortHonored": true,
      "label": "Gemini 3.8 Flash · high",
      "status": "ok",
      "svgFile": "agy__gemini-3.8-flash__high__mobius-strip-v1.svg",
      "startedAt": "2026-09-27T02:23:03.935Z",
      "finishedAt": "2026-09-27T02:26:03.578Z",
      "durationMs": 179643,
      "svgBytes": 29154,
      "error": null,
      "usage": {
        "tokens": {
          "input": 22926,
          "output": 48669
        },
        "reasoningTokens": 35403,
        "serviceTier": "standard",
        "reportedCostUsd": null
      },
      "rawFile": null
    }
  ],
  "redactions": []
}
